{
  "project_root": "skill/examples/demo_project",
  "generated_at": "2026-09-24",
  "generated_by": "CORPUS_AGENT (hand-written teaching example)",
  "items": [
    {"id": "E001", "kind": "result", "summary": "Baseline MAE without shift",
     "value": {"metric": "MAE", "mean": 0.412, "std": 0.006, "n": 5},
     "conditions": {"method": "baseline", "condition": "in_dist", "shift": 0.0},
     "locator": {"path": "results/summary.csv", "anchor": "row method=baseline,condition=in_dist"},
     "strength": "hard", "status": "ok"},
    {"id": "E002", "kind": "result", "summary": "RWN MAE without shift",
     "value": {"metric": "MAE", "mean": 0.409, "std": 0.007, "n": 5},
     "conditions": {"method": "rwn", "condition": "in_dist", "shift": 0.0},
     "locator": {"path": "results/summary.csv", "anchor": "row method=rwn,condition=in_dist"},
     "strength": "hard", "status": "ok"},
    {"id": "E003", "kind": "result", "summary": "Baseline MAE under level shift 0.2/0.4/0.6",
     "value": {"metric": "MAE", "by_shift": {"0.2": [0.471, 0.008], "0.4": [0.553, 0.010], "0.6": [0.641, 0.012]}, "n": 5},
     "conditions": {"method": "baseline", "condition": "level_shift"},
     "locator": {"path": "results/summary.csv", "anchor": "rows method=baseline,shift in {0.2,0.4,0.6}"},
     "strength": "hard", "status": "ok"},
    {"id": "E004", "kind": "result", "summary": "RWN MAE under level shift 0.2/0.4/0.6",
     "value": {"metric": "MAE", "by_shift": {"0.2": [0.421, 0.007], "0.4": [0.433, 0.008], "0.6": [0.452, 0.009]}, "n": 5},
     "conditions": {"method": "rwn", "condition": "level_shift"},
     "locator": {"path": "results/summary.csv", "anchor": "rows method=rwn,shift in {0.2,0.4,0.6}"},
     "strength": "hard", "status": "ok"},
    {"id": "E005", "kind": "negative_result", "summary": "At shift 0.8 RWN is not clearly better than baseline",
     "value": {"metric": "MAE", "baseline": [0.731, 0.015], "rwn": [0.712, 0.021], "n": 5},
     "conditions": {"condition": "level_shift", "shift": 0.8},
     "locator": {"path": "results/summary.csv", "anchor": "rows shift=0.8"},
     "strength": "hard", "status": "ok"},
    {"id": "E006", "kind": "result", "summary": "Ablation: statistics frozen after first post-shift window",
     "value": {"metric": "MAE", "mean": 0.518, "std": 0.011, "n": 5},
     "conditions": {"method": "rwn_fixed", "condition": "level_shift", "shift": 0.6},
     "locator": {"path": "results/summary.csv", "anchor": "row method=rwn_fixed"},
     "strength": "hard", "status": "ok"},
    {"id": "E007", "kind": "method_detail", "summary": "MLP (64 hidden), 168h history, 24h horizon, 5 seeds, identical for all methods",
     "value": null, "conditions": null,
     "locator": {"path": "config/experiment.yaml", "anchor": "model, training"},
     "strength": "hard", "status": "ok"},
    {"id": "E008", "kind": "limitation_noted", "summary": "Only synthetic data and one small MLP; only level shifts",
     "value": null, "conditions": null,
     "locator": {"path": "notes/lab_notes.md", "anchor": "## Limitations"},
     "strength": "soft", "status": "ok", "notes": "\"only synthetic data (synthload), one small MLP\"; \"only level shifts\""},
    {"id": "E009", "kind": "hypothesis_stated", "summary": "Stale normalization stats cause shift error; RWN should fix most of it without in-dist cost",
     "value": null, "conditions": null,
     "locator": {"path": "notes/lab_notes.md", "anchor": "## Hypothesis"},
     "strength": "soft", "status": "ok"},
    {"id": "E010", "kind": "result", "summary": "Early (pre-bug-fix) baseline MAE at shift 0.6 ≈ 0.66",
     "value": {"metric": "MAE", "mean": 0.66},
     "conditions": {"method": "baseline", "shift": 0.6, "note": "before test-split bug fix"},
     "locator": {"path": "notes/lab_notes.md", "anchor": "## Early run"},
     "strength": "soft", "status": "superseded", "conflicts_with": ["E003"],
     "notes": "Author states the run preceded a split bug fix; E003 is authoritative."},
    {"id": "E011", "kind": "assumption", "summary": "Window length 48 chosen by a quick try, not swept",
     "value": {"window": 48}, "conditions": null,
     "locator": {"path": "notes/lab_notes.md", "anchor": "## Decisions"},
     "strength": "soft", "status": "ok"},
    {"id": "E012", "kind": "dataset", "summary": "SynthLoad synthetic hourly series; 8760 train h, 2160 test h; level shifts 0.2-0.8 train-std units",
     "value": null, "conditions": null,
     "locator": {"path": "config/experiment.yaml", "anchor": "data"},
     "strength": "hard", "status": "ok"}
  ]
}
